Tipo de Promocion, Nombre, Tipo de Atraccion, Informacion Especifica Segun Tipo de Promocion, Lista de Atracciones
Absoluta, Pack Naturaleza, Aventura, 17, Montañas Grises + Bosque Negro
Porcentual, Pack Recorrido del Destino, Aventura, 40, Monte del Fuego Resplandeciente + Mordor
AxB, Pack Recorrido Culinario, Degustacion, Torre Oscura, Mar de Rhun + Fortaleza de Hierro + Torre Oscura
Absoluta, Pack paseo, Paisaje, 8, Bosque de Fangorn + Minas Tirith
Porcentual, Pack aventura, Aventura, 20, Bosque Negro + Mordor
Porcentual, Pack Recorrido por Tierra Media, Paisaje, 30, Bahia de Hielo de Forochel + Bosque Viejo + Bosque de Fangorn
